Сазонов Егор Александрович;526078, Курская область, город Истра, бульвар Сталина, 26
Устинов Али Леонидович;276888, Калининградская область, город Видное, спуск Гоголя, 49
Морозова Анна Артёмовна;513443, Рязанская область, город Талдом, бульвар Славы, 89
Федотов Артемий Егорович;495971, Калужская область, город Чехов, пр. Сталина, 35
Кузнецов Сергей Романович;773178, Курганская область, город Раменское, ул. Гагарина, 80
Архипова Полина Давидовна;799014, Челябинская область, город Шатура, бульвар Балканская, 66
ООО Рога и копыта;889691, Оренбургская область, город Мытищи, пр. Сталина, 08
ОАО СантехХмель;835964, Новосибирская область, город Шатура, ул. Ленина, 79
НКО АндеграундГидра;188474, Тюменская область, город Щёлково, ул. Домодедовская, 89
ОАО РыбТяжТехБанк;787672, Волгоградская область, город Кашира, наб. Гоголя, 00
ЗАО Пётр Генадьич и сыновья;5774 Kaden Ridge Garfieldville, FL 34559
