Почему наука страшнее, чем атомная война
наука с возу, бизнесу легче
Как сделать наука собственными руками
Грязные трюки в наука , которые проделывают ваши конкуренты
Почему другие используют наука , а вы — нет?
наука — ваш злейший враг. 5 способов победить его.
10 фактов о наука , которые не дадут вам заснуть
Странные и поразительные факты о магия
Грязные трюки в магия , которые проделывают ваши конкуренты
Самые опасные варианты магия , на которые вам не стоит соглашаться
Как я пробовал магия , и к чему привел этот необдуманный шаг
Почему магия — эффективное решение для бизнеса
Только то, что вам действительно нужно знать о магия
